{
  "$schema": "ir-extension-ledger-v1",
  "ledgerVersion": "1.0.0",
  "sourceRuleCount": 89,
  "counts": {
    "automated": 68,
    "runtime-obligation": 8,
    "ir-partial": 1,
    "enforced-elsewhere": 6,
    "human-judgment": 3,
    "advisory": 3
  },
  "rules": [
    {
      "ruleId": "action.collection.aggregate-type",
      "rfc": "RFC-2",
      "status": "automated",
      "requiredIr": [
        "collectionTransforms[].aggregate"
      ],
      "authoringSyntax": [],
      "schemaSupport": true,
      "parserSupport": false,
      "normalizerSupport": true,
      "handler": "check_collection_transforms",
      "positiveFixture": "tests/fixtures/valid/transportation-ir.json",
      "negativeFixture": "tests/fixtures/invalid/semantic-failures-ir.json",
      "targetClassification": "automated",
      "overrideReason": ""
    },
    {
      "ruleId": "action.collection.equality",
      "rfc": "RFC-2",
      "status": "automated",
      "requiredIr": [
        "collectionTransforms[].keys|equalityKeys"
      ],
      "authoringSyntax": [],
      "schemaSupport": true,
      "parserSupport": false,
      "normalizerSupport": true,
      "handler": "check_collection_transforms",
      "positiveFixture": "tests/fixtures/valid/transportation-ir.json",
      "negativeFixture": "tests/fixtures/invalid/semantic-failures-ir.json",
      "targetClassification": "automated",
      "overrideReason": ""
    },
    {
      "ruleId": "action.collection.field-resolution",
      "rfc": "RFC-2",
      "status": "automated",
      "requiredIr": [
        "collectionTransforms[].projections + inputSchema"
      ],
      "authoringSyntax": [],
      "schemaSupport": true,
      "parserSupport": false,
      "normalizerSupport": true,
      "handler": "check_collection_transforms",
      "positiveFixture": "tests/fixtures/valid/transportation-ir.json",
      "negativeFixture": "tests/fixtures/invalid/semantic-failures-ir.json",
      "targetClassification": "automated",
      "overrideReason": ""
    },
    {
      "ruleId": "action.collection.join-fanout",
      "rfc": "RFC-2",
      "status": "automated",
      "requiredIr": [
        "collectionTransforms[].expectedCardinality"
      ],
      "authoringSyntax": [],
      "schemaSupport": true,
      "parserSupport": false,
      "normalizerSupport": true,
      "handler": "check_collection_transforms",
      "positiveFixture": "tests/fixtures/valid/transportation-ir.json",
      "negativeFixture": "tests/fixtures/invalid/semantic-failures-ir.json",
      "targetClassification": "automated",
      "overrideReason": ""
    },
    {
      "ruleId": "action.collection.join-type",
      "rfc": "RFC-2",
      "status": "automated",
      "requiredIr": [
        "collectionTransforms[].joinKeys + inputs"
      ],
      "authoringSyntax": [],
      "schemaSupport": true,
      "parserSupport": false,
      "normalizerSupport": true,
      "handler": "check_collection_transforms",
      "positiveFixture": "tests/fixtures/valid/transportation-ir.json",
      "negativeFixture": "tests/fixtures/invalid/semantic-failures-ir.json",
      "targetClassification": "automated",
      "overrideReason": ""
    },
    {
      "ruleId": "action.collection.map-cardinality",
      "rfc": "RFC-2",
      "status": "automated",
      "requiredIr": [
        "collectionTransforms[].operation|expands"
      ],
      "authoringSyntax": [],
      "schemaSupport": true,
      "parserSupport": false,
      "normalizerSupport": true,
      "handler": "check_collection_transforms",
      "positiveFixture": "tests/fixtures/valid/transportation-ir.json",
      "negativeFixture": "tests/fixtures/invalid/semantic-failures-ir.json",
      "targetClassification": "automated",
      "overrideReason": ""
    },
    {
      "ruleId": "action.collection.order-total",
      "rfc": "RFC-2",
      "status": "automated",
      "requiredIr": [
        "collectionTransforms[].sort|keys"
      ],
      "authoringSyntax": [],
      "schemaSupport": true,
      "parserSupport": false,
      "normalizerSupport": true,
      "handler": "check_collection_transforms",
      "positiveFixture": "tests/fixtures/valid/transportation-ir.json",
      "negativeFixture": "tests/fixtures/invalid/semantic-failures-ir.json",
      "targetClassification": "automated",
      "overrideReason": ""
    },
    {
      "ruleId": "action.collection.projection-unique",
      "rfc": "RFC-2",
      "status": "automated",
      "requiredIr": [
        "collectionTransforms[].projections"
      ],
      "authoringSyntax": [],
      "schemaSupport": true,
      "parserSupport": false,
      "normalizerSupport": true,
      "handler": "check_collection_transforms",
      "positiveFixture": "tests/fixtures/valid/transportation-ir.json",
      "negativeFixture": "tests/fixtures/invalid/semantic-failures-ir.json",
      "targetClassification": "automated",
      "overrideReason": ""
    },
    {
      "ruleId": "action.collection.set-compatibility",
      "rfc": "RFC-2",
      "status": "automated",
      "requiredIr": [
        "collectionTransforms[].inputs schemas"
      ],
      "authoringSyntax": [],
      "schemaSupport": true,
      "parserSupport": false,
      "normalizerSupport": true,
      "handler": "check_collection_transforms",
      "positiveFixture": "tests/fixtures/valid/transportation-ir.json",
      "negativeFixture": "tests/fixtures/invalid/semantic-failures-ir.json",
      "targetClassification": "automated",
      "overrideReason": ""
    },
    {
      "ruleId": "action.compose.order",
      "rfc": "RFC-5",
      "status": "runtime-obligation",
      "requiredIr": [
        "saga/device-safety/event change-contract constructs"
      ],
      "authoringSyntax": [],
      "schemaSupport": false,
      "parserSupport": false,
      "normalizerSupport": false,
      "handler": null,
      "positiveFixture": null,
      "negativeFixture": null,
      "targetClassification": "runtime-obligation",
      "overrideReason": "Sequential-vs-concurrent safety depends on runtime read/write sets; enforced by the execution engine/scheduler, not statically. Terminal: runtime-obligation."
    },
    {
      "ruleId": "action.compose.saga",
      "rfc": "RFC-5",
      "status": "ir-partial",
      "requiredIr": [
        "compensation"
      ],
      "authoringSyntax": [
        "compensation"
      ],
      "schemaSupport": true,
      "parserSupport": true,
      "normalizerSupport": true,
      "handler": null,
      "positiveFixture": null,
      "negativeFixture": null,
      "targetClassification": "automated",
      "overrideReason": "IR 1.1 provides actions[].compensation (forward/compensation half). Multi-step saga ordering + durable state remain unrepresented (ledger: ir-partial, RFC-5); not automatable end-to-end yet."
    },
    {
      "ruleId": "action.concurrency.lost-update",
      "rfc": "RFC-4",
      "status": "automated",
      "requiredIr": [
        "expectedVersion"
      ],
      "authoringSyntax": [
        "expected-version"
      ],
      "schemaSupport": true,
      "parserSupport": true,
      "normalizerSupport": true,
      "handler": "check_action_execution_semantics",
      "positiveFixture": "tests/fixtures/valid/transportation-ir.json",
      "negativeFixture": "tests/fixtures/invalid/semantic-failures-ir.json",
      "targetClassification": "automated",
      "overrideReason": ""
    },
    {
      "ruleId": "action.concurrency.version",
      "rfc": "RFC-4",
      "status": "automated",
      "requiredIr": [
        "expectedVersion"
      ],
      "authoringSyntax": [
        "expected-version"
      ],
      "schemaSupport": true,
      "parserSupport": true,
      "normalizerSupport": true,
      "handler": "check_action_execution_semantics",
      "positiveFixture": "tests/fixtures/valid/transportation-ir.json",
      "negativeFixture": "tests/fixtures/invalid/semantic-failures-ir.json",
      "targetClassification": "automated",
      "overrideReason": ""
    },
    {
      "ruleId": "action.destructive.recovery",
      "rfc": "RFC-5",
      "status": "automated",
      "requiredIr": [
        "reversibility"
      ],
      "authoringSyntax": [
        "reversibility"
      ],
      "schemaSupport": true,
      "parserSupport": true,
      "normalizerSupport": true,
      "handler": "check_destructive_bulk_semantics",
      "positiveFixture": "tests/fixtures/valid/transportation-ir.json",
      "negativeFixture": "tests/fixtures/invalid/semantic-failures-ir.json",
      "targetClassification": "automated",
      "overrideReason": ""
    },
    {
      "ruleId": "action.destructive.retention",
      "rfc": "RFC-5",
      "status": "automated",
      "requiredIr": [
        "retention"
      ],
      "authoringSyntax": [
        "retention"
      ],
      "schemaSupport": true,
      "parserSupport": true,
      "normalizerSupport": true,
      "handler": "check_destructive_bulk_semantics",
      "positiveFixture": "tests/fixtures/valid/transportation-ir.json",
      "negativeFixture": "tests/fixtures/invalid/semantic-failures-ir.json",
      "targetClassification": "automated",
      "overrideReason": ""
    },
    {
      "ruleId": "action.destructive.scope",
      "rfc": "RFC-5",
      "status": "runtime-obligation",
      "requiredIr": [
        "saga/device-safety/event change-contract constructs"
      ],
      "authoringSyntax": [],
      "schemaSupport": false,
      "parserSupport": false,
      "normalizerSupport": false,
      "handler": null,
      "positiveFixture": null,
      "negativeFixture": null,
      "targetClassification": "runtime-obligation",
      "overrideReason": "Exposing the evaluated target count/preview requires evaluating the selection at runtime ('when technically feasible'); enforced by the runtime dry-run/preview path, not the static model. Terminal class: runtime-obligation."
    },
    {
      "ruleId": "action.device.safety",
      "rfc": "RFC-5",